{
  "schemaVersion": 1,
  "identity": {
    "productName": "ArchiveMe",
    "semanticVersion": "0.2.0",
    "buildNumber": 48,
    "bundleId": "com.voicememory.mobile",
    "commitSha": "1eabdc74cd255548af59e626a75f93f3731ea385",
    "buildEnvironment": "local-dev",
    "createdAt": "2026-08-13T08:37:19.511Z",
    "expirationPolicy": {
      "manifestStaleAfterDays": 7,
      "gateEvidenceStaleAfterDays": 7,
      "waiverMaxDays": 30
    },
    "distributionChannel": "testflight-internal"
  },
  "capabilities": {
    "sync": {
      "enabled": true,
      "registrySource": "apps/mobile/lib/router/app_router.dart (OfflineSyncVerificationScreen route in production graph)"
    },
    "storeBilling": {
      "enabled": false,
      "livePurchases": false,
      "registrySource": "apps/mobile/lib/core/config/v1_capability_registry.dart (storeBilling = false — billing frozen for focused beta; see docs/product/COMMERCIAL_REENTRY.md)"
    },
    "notifications": {
      "enabled": false,
      "registrySource": "apps/mobile/lib/core/config/v1_capability_registry.dart (notifications = false)"
    },
    "nativeExtensions": {
      "enabled": false,
      "registrySource": "apps/mobile/lib/core/config/v1_capability_registry.dart (nativeExtensions = false)"
    }
  },
  "gates": [
    {
      "id": "a_production_graph_analyzer",
      "title": "Production graph analyzer (zero errors/warnings)",
      "required": true,
      "conditionalOn": null,
      "status": "pass",
      "recordedAt": "2026-08-13T08:37:26.912Z",
      "commitSha": "1eabdc74cd255548af59e626a75f93f3731ea385",
      "buildNumber": 48,
      "environment": "local-gate-run",
      "evidencePath": "release/evidence/gate_a_production_graph_analyzer.log",
      "actor": {
        "type": "tool",
        "name": "bash apps/mobile/tool/analyze_production_graph.sh"
      },
      "notes": "analyze_production_graph: 51 file(s)\nAnalyzer (production graph): errors=0 warnings=0\nOK — production graph analyzer clean",
      "waiver": null,
      "section": "A",
      "automated": true,
      "nonWaivable": true
    },
    {
      "id": "a_route_cta_integrity",
      "title": "No active CTA to disallowed route",
      "required": true,
      "conditionalOn": null,
      "status": "pass",
      "recordedAt": "2026-08-13T08:37:28.089Z",
      "commitSha": "1eabdc74cd255548af59e626a75f93f3731ea385",
      "buildNumber": 48,
      "environment": "local-gate-run",
      "evidencePath": "release/evidence/gate_a_route_cta_integrity.log",
      "actor": {
        "type": "tool",
        "name": "validate_production_route_links + validate_production_billing_absence"
      },
      "notes": "validate_production_route_links: PASS",
      "waiver": null,
      "section": "A",
      "automated": true,
      "nonWaivable": true
    },
    {
      "id": "a_customer_language",
      "title": "No prohibited customer copy in production graph",
      "required": true,
      "conditionalOn": null,
      "status": "pass",
      "recordedAt": "2026-08-13T08:37:31.679Z",
      "commitSha": "1eabdc74cd255548af59e626a75f93f3731ea385",
      "buildNumber": 48,
      "environment": "local-gate-run",
      "evidencePath": "release/evidence/gate_a_customer_language.log",
      "actor": {
        "type": "tool",
        "name": "flutter test customer_language_production_copy_test.dart"
      },
      "notes": "00:00 +25: ../../apps/web/app/contact/page.tsx follows customer language policy\n00:00 +26: ../../apps/web/app/privacy/page.tsx follows customer language policy\n00:00 +27: All tests passed!",
      "waiver": null,
      "section": "A",
      "automated": true,
      "nonWaivable": false
    },
    {
      "id": "log_redaction",
      "title": "Log redaction / privacy log scan",
      "required": true,
      "conditionalOn": null,
      "status": "pass",
      "recordedAt": "2026-08-13T08:37:33.305Z",
      "commitSha": "1eabdc74cd255548af59e626a75f93f3731ea385",
      "buildNumber": 48,
      "environment": "local-gate-run",
      "evidencePath": "release/evidence/gate_log_redaction.log",
      "actor": {
        "type": "tool",
        "name": "npm run validate:privacy-logs"
      },
      "notes": "> voice-memory@0.1.0 validate:privacy-logs\n> node scripts/validate-privacy-logs.mjs\nvalidate-privacy-logs ok",
      "waiver": null,
      "section": "A",
      "automated": true,
      "nonWaivable": true
    },
    {
      "id": "sensitive_storage_scan",
      "title": "No personal-content persistence in plaintext preferences",
      "required": true,
      "conditionalOn": null,
      "status": "pass",
      "recordedAt": "2026-08-13T08:37:36.353Z",
      "commitSha": "1eabdc74cd255548af59e626a75f93f3731ea385",
      "buildNumber": 48,
      "environment": "local-gate-run",
      "evidencePath": "release/evidence/gate_sensitive_storage_scan.log",
      "actor": {
        "type": "tool",
        "name": "flutter test storage/mobile_prefs_policy_test.dart + bash scripts/validate-mobile-clean-working-tree.sh"
      },
      "notes": "00:00 +0: beta-scoped stores do not write personal content fields to prefs\n00:00 +1: encrypted personal content keys are allowlisted\n00:00 +2: All tests passed!",
      "waiver": null,
      "section": "A",
      "automated": true,
      "nonWaivable": true
    },
    {
      "id": "a_disabled_capability_imports",
      "title": "No production import/init of disabled billing/widgets/notifications/experiments",
      "required": true,
      "conditionalOn": null,
      "status": "pass",
      "recordedAt": "2026-08-13T08:37:40.641Z",
      "commitSha": "1eabdc74cd255548af59e626a75f93f3731ea385",
      "buildNumber": 48,
      "environment": "local-gate-run",
      "evidencePath": "release/evidence/gate_a_disabled_capability_imports.log",
      "actor": {
        "type": "tool",
        "name": "bash apps/mobile/tool/validate_v1_production_graph.sh"
      },
      "notes": "OK — launch product audit passed\n==> production route-link integrity\nvalidate_production_route_links: PASS",
      "waiver": null,
      "section": "A",
      "automated": true,
      "nonWaivable": true
    },
    {
      "id": "remote_consent_no_network_evidence",
      "title": "Zero network after consent decline/revoke",
      "required": true,
      "conditionalOn": null,
      "status": "pass",
      "recordedAt": "2026-08-13T08:37:45.493Z",
      "commitSha": "1eabdc74cd255548af59e626a75f93f3731ea385",
      "buildNumber": 48,
      "environment": "local-gate-run",
      "evidencePath": "release/evidence/gate_remote_consent_no_network_evidence.log",
      "actor": {
        "type": "tool",
        "name": "flutter test remote_processing_consent_gate_test.dart + capture_pipeline_consent_boundary_test.dart + security/remote_processing_consent_gate_test.dart"
      },
      "notes": "00:01 +11: /Users/chiragpatel/Projects/voice-memory/apps/mobile/test/remote_processing_consent_gate_test.dart: saveTextThought is gated: declined consent saves locally with zero network calls\n00:01 +12: /Users/chiragpatel/Projects/voice-memory/apps/mobile/test/remote_processing_consent_gate_test.dart: remote failure after consent does not erase a locally saved entry\n00:01 +13: All tests passed!",
      "waiver": null,
      "section": "B",
      "automated": true,
      "nonWaivable": true
    },
    {
      "id": "b_capture_archive_behavior",
      "title": "Capture, archive, evidence, export/delete automated behavior",
      "required": true,
      "conditionalOn": null,
      "status": "fail",
      "recordedAt": "2026-08-13T08:37:52.394Z",
      "commitSha": "1eabdc74cd255548af59e626a75f93f3731ea385",
      "buildNumber": 48,
      "environment": "local-gate-run",
      "evidencePath": "release/evidence/gate_b_capture_archive_behavior.log",
      "actor": {
        "type": "tool",
        "name": "apps/mobile/tool/focused_beta_behavior_tests.txt"
      },
      "notes": "ARCHIVEME_LOG event=auth_signOut_failed severity=error category=auth success=false error_code=http_400 http_status=400\n00:04 +93 -1: /Users/chiragpatel/Projects/voice-memory/apps/mobile/test/security/release_log_scan_test.dart: production graph scan skips test fixture paths\n00:04 +94 -1: Some tests failed.",
      "waiver": null,
      "section": "B",
      "automated": true,
      "nonWaivable": false
    },
    {
      "id": "export_delete",
      "title": "Export and delete account paths",
      "required": true,
      "conditionalOn": null,
      "status": "pass",
      "recordedAt": "2026-08-13T08:37:57.441Z",
      "commitSha": "1eabdc74cd255548af59e626a75f93f3731ea385",
      "buildNumber": 48,
      "environment": "local-gate-run",
      "evidencePath": "release/evidence/gate_export_delete.log",
      "actor": {
        "type": "tool",
        "name": "flutter test archive_export_pack_test.dart + delete_account_confirmation_test.dart"
      },
      "notes": "00:01 +28: /Users/chiragpatel/Projects/voice-memory/apps/mobile/test/delete_account_confirmation_test.dart: Delete account confirmation successful server deletion shows completion copy only after confirm\nARCHIVEME_LOG event=auth_signOut_failed severity=error category=auth success=false error_code=http_400 http_status=400\n00:02 +29: All tests passed!",
      "waiver": null,
      "section": "B",
      "automated": true,
      "nonWaivable": true
    },
    {
      "id": "c_android_release_build",
      "title": "Android release build",
      "required": true,
      "conditionalOn": null,
      "status": "not_run",
      "recordedAt": null,
      "commitSha": null,
      "buildNumber": null,
      "environment": "unrecorded",
      "evidencePath": null,
      "actor": {
        "type": "tool",
        "name": "flutter build apk --release"
      },
      "notes": null,
      "waiver": null,
      "section": "C",
      "automated": true,
      "nonWaivable": false
    },
    {
      "id": "c_ios_release_build",
      "title": "iOS release build (no codesign)",